Sheet: Sheet1
J1: Both | K1: LiFePO4
A2: 1FFF | B2: of:=HEX2DEC([.A2]) -> 8191 | C2: 8191 | D2: of:=DEC2HEX([.C2]) -> 1FFF | F2: Bits | G2: Range | I2: Battery Max | J2: 4200 | K2: 3700 | L2: 4202
A3: 0 | B3: of:=HEX2DEC([.A3]) -> 0 | C3: 8190 | D3: of:=DEC2HEX([.C3]) -> 1FFE | F3: 1 | G3: of:=2^[.F3] -> 2 | I3: Battery Min | J3: 2500 | K3: 1800 | L3: 2502
C4: 4000 | D4: of:=DEC2HEX([.C4]) -> FA0 | F4: 2 | G4: of:=2^[.F4] -> 4 | I4: Difference | J4: of:=[.J2]-[.J3] -> 1700 | K4: of:=[.K2]-[.K3] -> 1900 | L4: of:=[.L2]-[.L3] -> 1700
C5: 3200 | D5: of:=DEC2HEX([.C5]) -> C80 | F5: 3 | G5: of:=2^[.F5] -> 8 | I5: Bits | J5: of:=CEILING(LOG([.J4])/LOG(2)) -> 11 | K5: of:=CEILING(LOG([.K4])/LOG(2)) -> 11 | L5: of:=CEILING(LOG([.L4])/LOG(2)) -> 11
C6: 3000 | D6: of:=DEC2HEX([.C6]) -> BB8 | F6: 4 | G6: of:=2^[.F6] -> 16 | J6: Max
C7: 2000 | D7: of:=DEC2HEX([.C7]) -> 7D0 | F7: 5 | G7: of:=2^[.F7] -> 32 | I7: 11 bit range | J7: 4300 | K7: of:=[.J7]-[.G13] -> 2252
C8: 1800 | D8: of:=DEC2HEX([.C8]) -> 708 | F8: 6 | G8: of:=2^[.F8] -> 64 | J8: 3700 | K8: of:=[.J8]-[.G13] -> 1652
F9: 7 | G9: of:=2^[.F9] -> 128
F10: 8 | G10: of:=2^[.F10] -> 256
F11: 9 | G11: of:=2^[.F11] -> 512
F12: 10 | G12: of:=2^[.F12] -> 1024
F13: 11 | G13: of:=2^[.F13] -> 2048
F14: 12 | G14: of:=2^[.F14] -> 4096
F15: 13 | G15: of:=2^[.F15] -> 8192
F16: 14 | G16: of:=2^[.F16] -> 16384
F17: 15 | G17: of:=2^[.F17] -> 32768
F18: 16 | G18: of:=2^[.F18] -> 65536
J20: Bits | L20: Bytes | M20: Per byte header
H21: Highest cell voltage | J21: 11 | L21: 3 | M21: of:=([.L21]*8-[.$J$25])/[.L21] -> -1
H22: Combined cell voltage | J22: 11 | L22: 4 | M22: of:=([.L22]*8-[.$J$25])/[.L22] -> 1.25
H23: Status | J23: 3 | L23: 5 | M23: of:=([.L23]*8-[.$J$25])/[.L23] -> 2.6
H24: Balancing | J24: 2 | L24: 6 | M24: of:=([.L24]*8-[.$J$25])/[.L24] -> 3.5
J25: of:=SUM([.J21:.J24]) -> 27 | L25: 7 | M25: of:=([.L25]*8-[.$J$25])/[.L25] -> 4.14285714285714
G26: Byte | H26: 1 | I26: 2 | J26: 3 | K26: 4 | L26: 5
G29: Mask
G30: Value